{
  "schemaVersion": "1.0",
  "purpose": "A1 planning matrix: project-authored single-sentence targets. Recovered from git history after the automated-suite cleanup, annotated with the current construction mapping. This is a planning denominator only and is never a CEFR A1 percentage. Live capability witness status is derived by tests/lib/coverage.mjs from language manifests plus executed approved cases - never stored here.",
  "historicalBasis": {
    "sourcePath": "data/coverage/a1-targets.json",
    "sourceCommit": "da24043b9fd7ac4a5a946904063bce3f3c3b1241",
    "removedInCommit": "df7ab48 (Remove automated tests and add manual CLI guide, #257)",
    "note": "23 historical authorial targets (16 concepts, 7 constructions) replayed from the frozen planning matrix. Historical numeric-quantity scope (quantifier.exact 0..20, en/pl) is recorded for future planning; current manifests do not yet witness it."
  },
  "scope": {
    "level": "A1",
    "completeness": "project-authored-subset",
    "statement": "A1 is a deliberate internal project label for this bounded subset. It is not a CEFR certification and percentages computed over this file must never be presented as a CEFR A1 coverage score.",
    "denominator": "project_a1_targets"
  },
  "targets": [
    {
      "targetId": "concept.person.girl",
      "revision": "historical-planning-baseline",
      "historicalId": "person.girl",
      "unitType": "concept",
      "domain": "people",
      "kind": "entity",
      "concept": "person.girl",
      "tier": "required",
      "witnessKind": "positive",
      "directions": [
        "en-pl",
        "pl-en"
      ]
    },
    {
      "targetId": "concept.person.boy",
      "revision": "historical-planning-baseline",
      "historicalId": "person.boy",
      "unitType": "concept",
      "domain": "people",
      "kind": "entity",
      "concept": "person.boy",
      "tier": "planned",
      "witnessKind": "positive",
      "directions": [
        "en-pl",
        "pl-en"
      ],
      "note": "Planned: no approved positive sentence witnesses this concept yet."
    },
    {
      "targetId": "concept.person.child",
      "revision": "historical-planning-baseline",
      "historicalId": "person.child",
      "unitType": "concept",
      "domain": "people",
      "kind": "entity",
      "concept": "person.child",
      "tier": "planned",
      "witnessKind": "positive",
      "directions": [
        "en-pl",
        "pl-en"
      ],
      "note": "Planned: no approved positive sentence witnesses this concept yet."
    },
    {
      "targetId": "concept.person.woman",
      "revision": "historical-planning-baseline",
      "historicalId": "person.woman",
      "unitType": "concept",
      "domain": "people",
      "kind": "entity",
      "concept": "person.woman",
      "tier": "planned",
      "witnessKind": "positive",
      "directions": [
        "en-pl",
        "pl-en"
      ],
      "note": "Planned: no approved positive sentence witnesses this concept yet."
    },
    {
      "targetId": "concept.person.mother",
      "revision": "historical-planning-baseline",
      "historicalId": "person.mother",
      "unitType": "concept",
      "domain": "family",
      "kind": "entity",
      "concept": "person.mother",
      "tier": "required",
      "witnessKind": "positive",
      "directions": [
        "en-pl",
        "pl-en"
      ]
    },
    {
      "targetId": "concept.person.sister",
      "revision": "historical-planning-baseline",
      "historicalId": "person.sister",
      "unitType": "concept",
      "domain": "family",
      "kind": "entity",
      "concept": "person.sister",
      "tier": "planned",
      "witnessKind": "positive",
      "directions": [
        "en-pl",
        "pl-en"
      ],
      "note": "Planned: no approved positive sentence witnesses this concept yet."
    },
    {
      "targetId": "concept.person.brother",
      "revision": "historical-planning-baseline",
      "historicalId": "person.brother",
      "unitType": "concept",
      "domain": "family",
      "kind": "entity",
      "concept": "person.brother",
      "tier": "planned",
      "witnessKind": "positive",
      "directions": [
        "en-pl",
        "pl-en"
      ],
      "note": "Planned: no approved positive sentence witnesses this concept yet."
    },
    {
      "targetId": "concept.person.father",
      "revision": "historical-planning-baseline",
      "historicalId": "person.father",
      "unitType": "concept",
      "domain": "family",
      "kind": "entity",
      "concept": "person.father",
      "tier": "planned",
      "witnessKind": "positive",
      "directions": [
        "en-pl",
        "pl-en"
      ],
      "note": "Planned: no approved positive sentence witnesses this concept yet."
    },
    {
      "targetId": "concept.animal.dog",
      "revision": "historical-planning-baseline",
      "historicalId": "animal.dog",
      "unitType": "concept",
      "domain": "objects",
      "kind": "entity",
      "concept": "animal.dog",
      "tier": "required",
      "witnessKind": "positive",
      "directions": [
        "en-pl",
        "pl-en"
      ]
    },
    {
      "targetId": "concept.animal.cat",
      "revision": "historical-planning-baseline",
      "historicalId": "animal.cat",
      "unitType": "concept",
      "domain": "objects",
      "kind": "entity",
      "concept": "animal.cat",
      "tier": "planned",
      "witnessKind": "positive",
      "directions": [
        "en-pl",
        "pl-en"
      ],
      "note": "Planned: no approved positive sentence witnesses this concept yet."
    },
    {
      "targetId": "concept.object.book",
      "revision": "historical-planning-baseline",
      "historicalId": "object.book",
      "unitType": "concept",
      "domain": "objects",
      "kind": "entity",
      "concept": "object.book",
      "tier": "required",
      "witnessKind": "positive",
      "directions": [
        "en-pl",
        "pl-en"
      ]
    },
    {
      "targetId": "concept.object.bicycle",
      "revision": "current",
      "historicalId": null,
      "unitType": "concept",
      "domain": "objects",
      "kind": "entity",
      "concept": "object.bicycle",
      "tier": "required",
      "witnessKind": "positive",
      "directions": [
        "en-pl",
        "pl-en"
      ]
    },
    {
      "targetId": "concept.object.phone",
      "revision": "current",
      "historicalId": null,
      "unitType": "concept",
      "domain": "objects",
      "kind": "entity",
      "concept": "object.phone",
      "tier": "required",
      "witnessKind": "positive",
      "directions": [
        "en-pl",
        "pl-en"
      ]
    },
    {
      "targetId": "concept.object.table",
      "revision": "current",
      "historicalId": null,
      "unitType": "concept",
      "domain": "objects",
      "kind": "entity",
      "concept": "object.table",
      "tier": "required",
      "witnessKind": "positive",
      "directions": [
        "en-pl",
        "pl-en"
      ]
    },
    {
      "targetId": "concept.object.apple",
      "revision": "historical-planning-baseline",
      "historicalId": "object.apple",
      "unitType": "concept",
      "domain": "objects",
      "kind": "entity",
      "concept": "object.apple",
      "tier": "planned",
      "witnessKind": "positive",
      "directions": [
        "en-pl",
        "pl-en"
      ],
      "note": "Planned: no approved positive sentence witnesses this concept yet."
    },
    {
      "targetId": "concept.structure.house",
      "revision": "historical-planning-baseline",
      "historicalId": "structure.house",
      "unitType": "concept",
      "domain": "places",
      "kind": "entity",
      "concept": "structure.house",
      "tier": "planned",
      "witnessKind": "positive",
      "directions": [
        "en-pl",
        "pl-en"
      ],
      "note": "Planned: no approved positive sentence witnesses this concept yet."
    },
    {
      "targetId": "concept.institution.school",
      "revision": "historical-planning-baseline",
      "historicalId": "institution.school",
      "unitType": "concept",
      "domain": "places",
      "kind": "entity",
      "concept": "institution.school",
      "tier": "required",
      "witnessKind": "positive",
      "directions": [
        "en-pl",
        "pl-en"
      ]
    },
    {
      "targetId": "concept.organization.institution",
      "revision": "current",
      "historicalId": null,
      "unitType": "concept",
      "domain": "institutions",
      "kind": "entity",
      "concept": "organization.institution",
      "tier": "required",
      "witnessKind": "positive",
      "directions": [
        "en-pl",
        "pl-en"
      ]
    },
    {
      "targetId": "concept.quality.big",
      "revision": "historical-planning-baseline",
      "historicalId": "quality.big",
      "unitType": "concept",
      "domain": "descriptions",
      "kind": "property",
      "concept": "quality.big",
      "tier": "planned",
      "witnessKind": "positive",
      "directions": [
        "en-pl",
        "pl-en"
      ],
      "note": "Planned: no approved positive sentence witnesses this concept yet."
    },
    {
      "targetId": "concept.quality.small",
      "revision": "historical-planning-baseline",
      "historicalId": "quality.small",
      "unitType": "concept",
      "domain": "descriptions",
      "kind": "property",
      "concept": "quality.small",
      "tier": "planned",
      "witnessKind": "positive",
      "directions": [
        "en-pl",
        "pl-en"
      ],
      "note": "Planned: no approved positive sentence witnesses this concept yet."
    },
    {
      "targetId": "concept.quality.simple",
      "revision": "current",
      "historicalId": null,
      "unitType": "concept",
      "domain": "descriptions",
      "kind": "property",
      "concept": "quality.simple",
      "tier": "required",
      "witnessKind": "positive",
      "directions": [